dt_exe,doc_id,corp,boss,law,cnt_action,cnt_rule
2015-09-24,高市勞條字第10436995600號,台灣中油股份有限公司,,24;39,1,2
2015-09-24,高市勞條字第10436598500號,亞太國際物流股份有限公司,,32-2;36,1,2
2015-09-10,高市勞條字第10437017700號,中南汽車客運股份有限公司,,32-2,1,1
2015-09-18,高市勞條字第10437331400號,富潤應用材料實業有限公司,,23-2;30-5,1,2
2015-08-13,高市勞條字第10435842000號,高雄汽車客運股限公司,,32-2,1,1
2015-11-06,高市勞條字第10437999300號,宏華保全股份有限公司,,24;30-5;39,1,3
2015-10-06,高市勞條字第10437331600號,豐齊有限公司,,24;30-5,1,2
2015-10-15,高市勞條字第10437388000號,柯延鴻即茶鼎苑陽明店,,22-2;36,1,2
2015-10-15,高市勞條字第10437629300號,金美園環保有限公司,,9-1;30-5,1,2
2015-10-21,高市勞條字第10438070200號,高惠倪即倪娃娃創藝店,,22;30-5,1,2
2015-10-28,高市勞條字第10438486600號,曾振德即昇昱工程行,,22-2;30-5,1,2
2015-10-12,高市勞條字第10437679400號,百年好合企業有限公司,,39,1,1
2015-10-13,高市勞條字第10437679200號,富佶企業有限公司,,24,1,1
2015-10-15,高市勞條字第10437571500號,復興護理之家,,24,1,1
2015-10-23,高市勞條字第10437994300號,五克拉實業股份有限公司,,36,1,1
2015-11-02,高市勞條字第10437920600號,豐軒科技股份有限公司,,23-1,1,1
2015-11-10,高市勞條字第10438077301號,良安行有限公司,,38,1,1
2015-11-19,高市勞條字第10439132800號,鍾士敏即笛法美學沙龍,,30-5,1,1
2015-10-08,高市勞條字第10436842600號,紅布朗國際有限公司,,24;30-5,1,2
2015-09-03,高市勞條字第10436597300號,國巨股份有限公司,,32-2,1,1
2015-08-25,高市勞條字第10435961500號,太洋尼龍股份有限公司,,32-3;36,1,2
2015-12-07,高市勞條字第10439092400號,高雄佳醫護理之家,,32-2,1,1
2015-12-07,高市勞條字第10438806200號,凡迪美容有限公司,,30-5,1,1
2015-12-07,高市勞條字第10438691200號,田邦廷即邦廷魯味,,36;38,1,2
2015-12-07,高市勞條字第10438613200號,銨倢企業有限公司,,24;30-5;39,1,3
2015-12-07,高市勞條字第10439415800號,聯橋健康事業股份有限公司,,32-2;39,1,2
2015-12-07,高市勞條字第10439583100號,日安環保工程股份有限公司,,30-5;36,1,2
2015-12-08,高市勞條字第10438885400號,義守大學,,32-2,1,1
2015-12-08,高市勞條字第10438760900號,蔡志君即蔡志君中醫診所,,30-5,1,1
2015-12-08,高市勞條字第10439461500號,千翔保全股份有限公司,,24,1,1
2015-12-08,高市勞條字第10439603800號,均辰祥企業有限公司,,38;39,1,2
2015-12-10,高市勞條字第10439069200號,大豐旅行社有限公司,,24,1,1
2015-12-11,高市勞條字第10439094800號,元椿實業有限公司,,22-2,1,1
2015-12-14,高市勞條字第10439264200號,新東福實業有限公司,,23-2;30-5,1,2
2015-12-14,高市勞條字第10439082100號,進盛實業有限公司,,30-5,1,1
2015-12-14,高市勞條字第10439450300號,優生婦產科醫院,,34,1,1
2015-12-14,高市勞條字第10439446500號,林福壽即正川資訊社,,30-5,1,1
2015-12-14,高市勞條字第10439102200號,薩摩亞商皇庭珠寶有限公司高雄分公司,,24;36;39,1,3
2015-12-15,高市勞條字第10438612600號,纖薇美容坊有限公司,,24;39,1,2
2015-12-15,高市勞條字第10439607700號,吉田耳鼻喉科診所,,24;36,1,2
2015-12-15,高市勞條字第10439771000號,楊川即楊記麻辣臭臭鍋,,23-2;30-5,1,2
2015-12-15,高市勞條字第10439751100號,先怡企業有限公司,,21-1,1,1
2015-12-16,高市勞條字第10439457400號,寵物王國有限公司,,32-2,1,1
2015-12-17,高市勞條字第10439756400號,洪郁盛即鼎優企業社,,80,1,1
2015-12-17,高市勞條字第10439125800號,龍畿企業股份有限公司,,32-2,1,1
2015-12-17,高市勞條字第10439411100號,高明怡即高鮮現打果汁,,21-1;36,1,2
2015-12-18,高市勞條字第10439291100號,大洋保全股份有限公司,,30-5,1,1
2015-12-18,高市勞條字第10439103800號,吳世昌即茶鮮坊,,24;36;39,1,3
2015-12-18,高市勞條字第10439028000號,京旺創意有限公司,,30-5,1,1
2015-12-18,高市勞條字第10439049900號,江記有限公司,,30-5,1,1
2015-12-21,高市勞條字第10439961200號,台灣富士全錄股份有限公司,,24,1,1
2015-12-21,高市勞條字第10439913500號,高雄市私立鳴志升學文理短期補習班,,24;36,1,2
2015-12-21,高市勞條字第10439960900號,鉅明股份有限公司,,24,1,1
2015-12-21,高市勞條字第10439668100號,英倫國際實業股份有限公司,,22-2,1,1
2015-12-21,高市勞條字第10439192900號,秀傳護理之家,,24,1,1
2015-12-22,高市勞條字第10439195300號,高億人力資源管理有限公司,,22-2,1,1
2015-12-22,高市勞條字第10439160600號,得其股份有限公司,,30-5,1,1
2015-12-22,高市勞條字第10439630400號,財團法人私立高雄醫學大學,,30-5,1,1
2015-12-23,高市勞條字第10439720400號,富邦人壽保險股份有限公司,,32-2,1,1
2015-12-23,高市勞條字第10440044000號,不二家,,32-2;36,1,2
2015-12-23,高市勞條字第10439263700號,高雄市私立北一升學文理工商管理短期習班遠見分班,,21-1,1,1
2015-12-23,高市勞條字第10440227900號,台灣三美股份有限公司,,9;38,1,2
2015-12-24,高市勞條字第10440228400號,聖遠企業有限公司,,21-1,1,1
2015-12-24,高市勞條字第10439368600號,高雄氣體股份有限公司,,21-1,1,1
2015-12-24,高市勞條字第10439530100號,宏典旅行社有限公司,,30-5,1,1
2015-12-24,高市勞條字第10439327800號,允福營造有限公司,,38,1,1
2015-12-24,高市勞條字第10439537100號,先鋒保全股份有限公司,,30-5,1,1
2015-12-24,高市勞條字第10439537200號,汪賜海,,30-5,1,1
2015-12-24,高市勞條字第10439536500號,一零三金文具有限公司,,36,1,1
2015-12-25,高市勞條字第10440210500號,旗鴻通運有限公司,,32-2,1,1
2015-12-25,高市勞條字第10439366200號,羅條原即原園日式涮涮鍋,,36;39,1,2
2015-12-25,高市勞條字第10439367800號,貝爾手工餅乾專賣店,,22-2,1,1
2015-12-25,高市勞條字第10439925800號,精上企業有限公司,,30-5;38;39,1,3
2015-12-25,高市勞條字第10439873900號,川湖科技股份有限公司,,24,1,1
2015-12-25,高市勞條字第10439461400號,全國加油站股份有限公司,,24,1,1
2015-12-25,高市勞條字第10439647800號,澄園護理之家,,30-5;39,1,2
2015-12-25,高市勞條字第10439302800號,臺灣航勤股份有限公司,,32-2,1,1
2015-12-25,高市勞條字第10440223300號,莊惠程即太妃堂藏御茶坊,,23-2;30-5;36,1,3
2015-12-25,高市勞條字第10439619700號,博正護理之家,,24;32-2,1,2
2015-12-29,高市勞條字第10440232400號,李亭蓁,,27,1,1
2015-12-31,高市勞條字第10439375100號,高雄市政府社會局兒童福利中心委託大仁科技大學承辦高雄市三民兒福公共托嬰中心,,23-1,1,1
2016-01-04,高市勞條字第10439532200號,合順通運有限公司,,22-2;30-5,1,2
2016-01-05,高市勞條字第10440115300號,社團法人中華民國唐氏症關愛者協會,,32-2,1,1
2016-01-04,高市勞條字第10440389700號,高雄江山管理委員會,,24;30-5;32-2,1,3
2016-01-04,高市勞條字第10440390000號,中紡科技實業股份有限公司,,36,1,1
2015-01-05,高市勞條字第10439717500號,崇恩護理之家,,24,1,1
2016-01-04,高市勞條字第10439977700號,皇盟工程企業有限公司,,22-2;30-5,1,2
2016-01-04,高市勞條字第10439888100號,沅勝國際有限公司,,32-2;38,1,2
2016-01-05,高市勞條字第10439754600號,蔡忠憲即昱名五金行,,24,1,1
2016-01-06,高市勞條字第10439977800號,蘇鳳琴即冰心茶王冷飲店,,22-2,1,1
2016-01-05,高市勞條字第10440044700號,業永實業有限公司,,30-5,1,1
2016-01-05,高市勞條字第10440097700號,富康旅行社股份有限公司,,22-2,1,1
2016-01-06,高市勞條字第10439619100號,李珮瑜即李氏商行,,22-2;24;32-2,1,3
2016-01-06,高市勞條字第10439873000號,大新保全股份有限公司,,21-1;30-5;39,1,3
2016-01-06,高市勞條字第10440475000號,京城保全股份有限公司,,24;30-5;32-2,1,3
2016-01-06,高市勞條字第10439495500號,鄭漢立即郭董臭臭鍋,,23-2;30-5,1,2
2016-01-07,高市勞條字第10439931700號,台力橡膠股份有限公司,,22-2;24,1,2
2016-01-08,高市勞條字第10440122300號,萬寶華企業管理顧問股份有限公司,,24,1,1
2016-01-08,高市勞條字第10440122100號,台灣雷克有限公司,,30-5,1,1
2016-01-08,高市勞條字第10439926100號,新鎮生鮮大賣場有限公司,,30-5;36;39,1,3
2016-01-08,高市勞條字第10530050200號,建平通運有限公司,,30-5;36,1,2
2016-01-08,高市勞條字第10440461300號,穗羽企業有限公司,,22-2,1,1
2016-01-08,高市勞條字第10439872500號,吳品繐即慈心企業社,,32-2;36;30-5,1,3
2016-01-08,高市勞條字第10440459700號,順豐行銷有限公司,,23-2;30-5,1,2
2016-01-08,高市勞條字第10530105700號,寒軒國際大飯店股份有限公司,,39,1,1
2016-01-08,高市勞條字第10439786300號,富達運輸股份有限公司,,22-2;32-2,1,2
2016-01-08,高市勞條字第10530176200號,劉慧美即高雄市私立弘學文理短期補習班,,36,1,1
2016-01-11,高市勞條字第10530044400號,侑特科技股份有限公司,,22-2;32-2;36,1,3
2016-01-11,高市勞條字第10530028000號,陳瑞光即大慶診所,,30-5;36,1,2
2016-01-12,高市勞條字第10530182000號,蔡忠南即璟田設計坊,,23-2;30-5,1,2
2016-01-12,高市勞條字第10439807000號,阡悅企業有限公司,,22-2,1,1
2016-01-13,高市勞條字第10530309000號,高雄商旅飯店股份有限公司,,39,1,1
2016-01-12,高市勞條字第10439925900號,統一速達股份有限公司,,32-2,1,1
2016-01-12,高市勞條字第10439926700號,煒智企業有限公司,,24;30-5;38,1,3
2016-01-12,高市勞條字第10530302600號,詠伸國際企業有限公司,,32-2;36,1,2
2016-01-13,高市勞條字第10440140800號,瑪琪朵朵有限公司,,24,1,1
2016-01-14,高市勞條字第10530301200號,寬興科技股份有限公司,,23-1,1,1
2016-01-14,高市勞條字第10530301900號,永盛綜合企業有限公司,,39,1,1
2016-01-14,高市勞條字第10530320100號,許棋楠即真手藝壽司,,21-1,1,1
2016-01-14,高市勞條字第10530302200號,百康通運有限公司,,36,1,1
2016-01-14,高市勞條字第10440284200號,國雲保全股份有限公司,,22-2,1,1
2016-01-14,高市勞條字第10530076300號,金永隆實業股份有限公司,,22-2,1,1
2016-01-14,高市勞條字第10439888500號,巨將保全股份有限公司,,30-5,1,1
2016-01-15,高市勞條字第10439887800號,麗鴻科技股份有限公司,,24;38,1,2
2016-01-15,高市勞條字第10440345100號,裕達冷凍食品有限公司,,24,1,1
2016-01-15,高市勞條字第10530320200號,洪慈怡,,21-1,1,1
2016-01-15,高市勞條字第10530253200號,許貴皇,,80,1,1
2016-01-15,高市勞條字第10440077800號,富滄海洋股份有限公司,,22-2;30-5,1,2
2016-01-18,高市勞條字第10440343400號,明達通運有限公司,,36,1,1
2016-01-19,高市勞條字第10530028400號,葉耀鴻即御川屋,,30-5;36,1,2
2016-01-18,高市勞條字第10530076700號,天然成生物科技有限公司,,30-5,1,1
2016-01-18,高市勞條字第10530028200號,亞米家保全有限公司,,24;32-2;36,1,3
2016-01-18,高市勞條字第10530028600號,良安行有限公司,,34-2,1,1
2016-01-18,高市勞條字第10530396800號,皇緯實業股份有限公司,,24;39,1,2
2016-01-18,高市勞條字第10530276200號,金祥益工程有限公司,,32-2;36,1,2
2016-01-19,高市勞條字第10440378500號,台灣弼奧股份有限公司,,32-2,1,1
2016-01-19,高市勞條字第10440345200號,長春醫院,,22-2,1,1
2016-01-19,高市勞條字第10530343400號,一亨運動用品股份有限公司,,49-1,1,1
2016-01-20,高市勞條字第10530266400號,聯合保全股份有限公司,,22-2;30-5,1,2
2016-01-20,高市勞條字第10530214100號,富蘭克林證券投資顧問股份有限公司,,24;30-5,1,2
2016-01-20,高市勞條字第10530401700號,一甲營造有限公司,,22-2,1,1
2016-01-20,高市勞條字第10440462000號,陳文洲即阿線企業行,,80,1,1
2016-01-20,高市勞條字第10440378200號,陳劍春即黃金曼商行,,21-1;24,1,2
2016-01-20,高市勞條字第10439956000號,荷蘭商仕寶保險公證股份有限公司台灣分公司,,30-5,1,1
2016-01-20,高市勞條字第10530130700號,台灣苯乙烯工業股份有限公司,,24;32-2;36;39,1,4
2015-09-15,高市勞條字第10436598800號,中華郵政股份有限公司,,30-5,1,1
2015-11-11,高市勞條字第10438153200號,龍典工業股份有限公司,,24;36,1,2
2015-10-26,高市勞條字第10437831600號,真善美養護家園,,24,1,1
2015-11-16,高市勞條字第10438312000號,路得不動產有限公司,,24,1,1
2015-11-24,高市勞條字第10438393600號,剛健鋼鐵工業股份有限公司,,22-2,1,1
2015-12-01,高市勞條字第10438844700號,劉智美即韓福香小吃店,,30-5,1,1
2015-11-10,高市勞條字第10438077300號,良安行有限公司,,22-2,1,1
2015-12-10,高市勞條字第10438825800號,昶澄企業有限公司,,24;32-2,1,2
2015-12-16,高市勞條字第10439160400號,台灣中油股份有限公司,,55,1,1
2015-12-17,高市勞條字第10439103900號,禾億五金有限公司,,32-2,1,1
2015-12-18,高市勞條字第10439101900號,黃鴻隆,,21-1;22-2,1,2
2015-12-18,高市勞條字第10439369100號,好爸爸居家消毒除蟲有限公司,,30-5,1,1
2015-12-18,高市勞條字第10438895600號,社團法人高雄市路竹社會福利協會,,30-5,1,1
2015-12-23,高市勞條字第1043930250A號,炭火燒肉有限公司,,39;43,1,2
2015-12-24,高市勞條字第10439161000號,台灣中油股份有限公司,,24;39,1,2
2016-01-04,高市勞條字第10439975900號,李珮珍即酒窩食堂,,21-1;22-2;30-5,1,3
2016-01-05,高市勞條字第10530051200號,鄭元璋即勁勇企業社,,30-5,1,1
2016-01-20,高市勞條字第10440378200號,陳劍春即黃金曼商行,,21-1;24,1,2
2016-01-21,高市勞條字第10530451800號,三英鋼鐵股份有限公司,,39,1,1
2016-01-22,高市勞條字第10530276000號,信齊保全股份有限公司,,30-5,1,1
2016-01-25,高市勞條字第10530413800號,李珮羢即旭盛食品行,,22-2,1,1
2016-01-25,高市勞條字第10530207300號,正泰精密工業有限公司,,24;32-2,1,2
2016-01-25,高市勞條字第10530620100號,玖盛保全股份有限公司,,24;32-2;36,1,3
2016-01-25,高市勞條字第10440378100號,鄧記餐飲有限公司,,32-2,1,1
2016-01-25,高市勞條字第10530206900號,常友股份有限公司,,30-5,1,1
2016-01-25,高市勞條字第10530206400號,漢衛公寓大廈管理維護股份有限公司,,24;32-2;35;38;39,1,5
2016-01-25,高市勞條字第1053020640A號,漢衛公寓大廈管理維護股份有限公司,,30-5,1,1
2016-01-27,高市勞條字第10530484800號,南隆塑膠廠股份有限公司,,32-2;36,1,2
2016-01-28,高市勞條字第10440290400號,英屬百慕達商友邦人壽保險股份有限公司台灣分公司,,24,1,1
2016-01-28,高市勞條字第10530578300號,一零三金文具有限公司,,30-5;39,1,2
2016-01-29,高市勞條字第10530346600號,高珍企業股份有限公司,,24;32-2,1,2
2016-01-29,高市勞條字第10530530000號,鄭弘毅即伊利斯商行,,22-2,1,1
2016-01-29,高市勞條字第10530343900號,嘉寶餐飲有限公司,,21-1;24;36,1,3
2016-01-30,高市勞條字第10530591500號,鈺惠有限公司,,21-1,1,1
2016-01-30,高市勞條字第1053059150A號,鈺惠有限公司,,30-5,1,1
2016-01-30,高市勞條字第10530516100號,高雄市私立福慧兒童課後照顧服務中心,,22-2,1,1
2016-02-01,高市勞條字第10530652100號,劉登荃,,24;32-2,1,2
2016-02-02,高市勞條字第10530590200號,順茂工業有限公司,,22-2;24;39,1,3
2016-02-03,高市勞條字第10530017800號,賀昱企業有限公司,,24;32-2,1,2
2016-02-03,高市勞條字第10530076600號,燁興企業股份有限公司,,32-2,1,1
2016-02-04,高市勞條字第10530126800號,展澄企業有限公司,,32-2;36,1,2
2016-02-04,高市勞條字第10530845200號,蟻群食品行,,24;32-2,1,2
2016-02-04,高市勞條字第10530740100號,花旗(台灣)商業銀行股份有限公司,,24,1,1
2016-02-04,高市勞條字第10530036200號,日商鹿島營造股份有限公司台灣分公司,,32-2,1,1
2016-02-04,高市勞條字第10530711900號,技泓企業有限公司,,22-2,1,1
2016-02-04,高市勞條字第10530355400號,陸潔有限公司,,22-2,1,1
2016-02-04,高市勞條字第10530590300號,郭祥榮,,59,1,1
2016-02-05,高市勞條字第10530893000號,權通有限公司,,27,1,1
2016-02-04,高市勞條字第10530714400號,貓尾巴有限公司,,24;32-2,1,2
2016-02-17,高市勞條字第10530710500號,陽光禮儀股份有限公司,,24;30-5,1,2
2016-02-05,高市勞條字第10530911200號,春迪企業股份有限公司,,22-2,1,1
2016-02-05,高市勞條字第10530561600號,聯揚國際開發有限公司,,30-5,1,1
2016-02-05,高市勞條字第10530714300號,許逸群即老大粥,,39,1,1
2016-02-05,高市勞條字第10530914900號,林仲明即童欣創意企業社,,24;36,1,2
2016-02-05,高市勞條字第10530207000號,華王大飯店股份有限公司,,24;36,1,2
2016-02-05,高市勞條字第10530225100號,高雄市私立康澤幼兒園,,24,1,1
2016-02-15,高市勞條字第10530308500號,全聯實業股份有限公司,,32-2,1,1
2016-02-15,高市勞條字第10530964600號,愛宴食坊有限公司,,36,1,1
2016-02-15,高市勞條字第10530516600號,龍衛保全股份有限公司,,21-1;22-2;24,1,3
2016-02-16,高市勞條字第10530420200號,高雄市私立蒲公英美語短期補習班,,30-5,1,1
2016-02-17,高市勞條字第10531042900號,南誠實業股份有限公司,,30-5,1,1
2016-02-17,高市勞條字第10530911300號,鑫新國際有限公司,,39,1,1
2016-02-17,高市勞條字第10530484900號,台灣善美的股份有限公司,,24,1,1
2016-02-18,高市勞條字第10530973400號,黑鮪魚大飯店股份有限公司,,24;34,1,2
2016-02-18,高市勞條字第10530981400號,吉曜工程企業有限公司,,21-1;24,1,2
2016-02-18,高市勞條字第10530644200號,全來工程有限公司,,24;36;39,1,3
2016-02-18,高市勞條字第10530794600號,全聯實業股份有限公司,,23-1,1,1
2016-02-19,高市勞條字第10531128100號,邵志盛即柏衍工程行,,80,1,1
2016-02-19,高市勞條字第1053056900號,宋韋霆即炸去啃炸雞商行,,22-2,1,1
2016-02-19,高市勞條字第10530583100號,大同奧的斯電梯股份有限公司,,36,1,1
2016-02-22,高市勞條字第10530592300號,新偉國際管理顧問股份有限公司,,24,1,1
2016-02-22,高市勞條字第10530690900號,統聯汽車客運有限公司,,32-2,1,1
2016-02-22,高市勞條字第10530896300號,許文德即田園小吃部,,80,1,1
2016-02-22,高市勞條字第10530743700號,陳儷壬即上品月子外送餐坊,,23-2;30-5;36,1,3
2016-02-22,高市勞條字第10530977800號,中將電子實業有限公司,,24;38;39,1,3
2016-02-22,高市勞條字第10530962800號,友宏有限公司,,30-5,1,1
2016-02-23,高市勞條字第10531205300號,康漢生技股份有限公司,,22;24,1,2
2016-02-24,高市勞條字第10531195100號,王品餐飲股份有限公司,,24,1,1
2016-02-23,高市勞條字第10530912900號,王俊傑即立嵐紅綠茶專賣店,,21-1;24,1,2
2016-02-23,高市勞條字第10531006900號,財團法人伊甸社會福利基金會,,39,1,1
2016-02-24,高市勞條字第10531124600號,陪你有限公司,,22-2;23-2;30-5,1,3
2016-02-25,高市勞條字第10531256200號,嘉楠通信器材有限公司,,24,1,1
2016-02-25,高市勞條字第10531272700號,弘耘設計工程有限公司,,27,1,1
2016-02-26,高市勞條字第10530997600號,七賢脊椎外科醫院,,22-2,1,1
2016-03-01,高市勞條字第10530847400號,強固保全股份有限公司,,22-2;38,1,2
2016-03-02,高市勞條字第10531395200號,高雄餅食品有限公司,,36,1,1
2016-03-02,高市勞條字第10530887200號,萬安生命科技股份有限公司,,30-5;32-2;36,1,3
2016-03-02,高市勞條字第10531189400號,慈惠診所,,39,1,1
2016-03-03,高市勞條字第10531477100號,一晟建材有限公司,,30-5,1,1
2016-03-03,高市勞條字第10531293200號,華陀扶元堂生藥科技股份有限公司,,24;32-2;39,1,3
2016-03-03,高市勞條字第10531355100號,新富發有限公司,,24;32-2;36;39,1,4
2016-03-03,高市勞條字第10530886900號,大同綜合訊電股份有限公司,,24;32-2,1,2
2016-03-04,高市勞條字第10530933700號,高雄市私立富華養護中心,,24;32-2,1,2
2016-03-04,高市勞條字第10531489400號,巨將保全股份有限公司,,30-5,1,1
2016-03-04,高市勞條字第10531006800號,齊洋企業有限公司,,32-2,1,1
2016-03-04,高市勞條字第10531147400號,波特嫚國際生物科技股份有限公司,,32-2,1,1
2016-03-04,高市勞條字第10531472900號,七海電業股份有限公司,,24;32-2,1,2
2016-03-07,高市勞條字第10531399400號,益又康國際行銷股份有限公司,,24,1,1
2016-03-08,高市勞條字第10531377200號,楊淑錦即幸福空間傢飾店,,30-5,1,1
2016-03-08,高市勞條字第10531376900號,謝萬樂即小港泰越商店,,39,1,1
2016-03-08,高市勞條字第10531377000號,謝萬樂即站前泰越印商店,,30-5,1,1
2016-03-08,高市勞條字第10531377100號,謝萬樂即大寮泰越印商店,,39,1,1
2016-03-08,高市勞條字第10531371500號,信祥股份有限公司,,30-5,1,1
2016-03-09,高市勞條字第10531625000號,蕭政維即品御茶飲專賣店,,21-1;22-2;39,1,3
2016-03-10,高市勞條字第10531147500號,臺灣人壽保險股份有限公司,,24,1,1
2016-03-10,高市勞條字第10531519900號,聲秦企業有限公司,,22-2;24,1,2
2016-03-10,高市勞條字第10531399700號,輝創電子股份有限公司,,32-2,1,1
2016-03-10,高市勞條字第10531519700號,劦清企業有限公司,,32-2,1,1
2016-03-11,高市勞條字第10531718000號,丞邦貨運有限公司,,30-5;39,1,2
2016-03-11,高市勞條字第10531348300號,威爾斯美語股份有限公司,,23-1;24;39,1,3
2016-03-14,高市勞條字第10531160600號,台灣牛角電影有限公司,,23-2,1,1
2016-03-14,高市勞條字第1053116060A號,台灣牛角電影有限公司,,30-5,1,1
2016-03-15,高市勞條字第10531007500號,台灣高速鐵路股份有限公司,,24,1,1
2016-03-15,高市勞條字第10531727900號,黃麗琴即you tea樂活茶飲,,23-2;30-5,1,2
2016-03-15,高市勞條字第10531795800號,華佑物業管理顧問有限公司,,24;32-2;39,1,3
2016-03-15,高市勞條字第10531734600號,許麗美即亞舍紅茶冰瑞隆店,,36,1,1
2016-03-16,高市勞條字第10531652500號,地平線國際蔬果有限公司,,80,1,1
2016-03-16,高市勞條字第10531112300號,飛天機有限公司,,22-2,1,1
2016-03-16,高市勞條字第10531086500號,高雄漢王洲際飯店有限公司,,22-2,1,1
2016-03-16,高市勞條字第10531519600號,佳銓工程有限公司,,30-5,1,1
2016-03-18,高市勞條字第1053120490A號,品宏通訊有限公司,,30-5,1,1
2016-03-18,高市勞條字第10531923800號,陳劍春即耶加雪夫商行,,21-1;24,1,2
2016-03-18,高市勞條字第10531204900號,品宏通訊有限公司,,24;39,1,2
2016-03-18,高市勞條字第10531147300號,雙漁股份有限公司,,36,1,1
2016-03-18,高市勞條字第10531921800號,京鴻物業管理顧問股份有限公司,,21-1;24;32-2;34;36,1,5
2016-03-18,高市勞條字第10531153400號,祐春企業股份有限公司,,24;39;43,1,3
2016-03-18,高市勞條字第10531231500號,永鼎有限公司,,22-2;24;32-2,1,3
2016-03-21,高市勞條字第10531927000號,高雄汽車客運股份有限公司,,30-5;32-2;36,1,3
2016-03-21,高市勞條字第10531818400號,弘達流通股份有限公司,,24;32-2,1,2
2016-03-21,高市勞條字第10532011700號,高珍企業股份有限公司,,30-5,1,1
2016-03-21,高市勞條字第10532004700號,美食家食材通路股份有限公司,,24;32-2,1,2
2016-03-22,高市勞條字第10532009300號,大榮汽車有限公司,,21-1;24;32-2;36,1,4
2016-03-22,高市勞條字第10531695700號,財團法人高雄市私市宏仁老人長期照顧中心(養護型),,21-1,1,1
2016-03-23,高市勞條字第10531826000號,茂新營造工程股份有限公司,,24;36,1,2
2016-03-23,高市勞條字第10531848700號,毅誠物業綜合事業有限公司,,30-5,1,1
2016-03-23,高市勞條字第10532005100號,林雪妹即圓點子髮型設計,,30-5,1,1
2016-03-23,高市勞條字第10532014300號,張東生即力大工程行,,59,1,1
2016-03-23,高市勞條字第10531882200號,全家便利商店股份有限公司,,30-5,1,1
2016-03-23,高市勞條字第10532019500號,華南商業銀行股份有限公司,,24,1,1
2016-03-23,高市勞條字第10532000300號,國登營造股份有限公司,,24;32;36;39,1,4
2016-03-23,高市勞條字第10531451500號,亞炬企業股份有限公司,,32-2;36,1,2
2016-03-24,高市勞條字第10531291800號,元鼎國際企業股份有限公司,,32-2,1,1
2016-03-24,高市勞條字第10532014400號,杰諾國際有限公司,,22-2;24;36;39,1,4
2016-03-25,高市勞條字第10532068500號,郁冠食品有限公司,,30-5,1,1
2016-03-28,高市勞條字第10531370100號,吉旺通運有限公司,,32-2,1,1
2016-03-28,高市勞條字第10532129000號,方漢武即漢王食品行,,32-2,1,1
